{
  "schema": "rll.execution_queue.v1",
  "generated_at": "2026-08-06T04:52:00Z",
  "repository": "instituto-Rafael/relativity-living-light",
  "source_main_commit": "e7997693d4038f379aa0d960a3485f61e94d454b",
  "merged_prs": {
    "645": "73872e3e8aa036d0973a2078f94b87bff2293992",
    "646": "e7997693d4038f379aa0d960a3485f61e94d454b"
  },
  "claim_allowed": false,
  "invariants": [
    "catalog_or_checkpoint_is_not_materialized_evidence",
    "existing_implemented_architecture_must_not_be_duplicated",
    "derived_value_does_not_replace_source_bytes",
    "physical_execution_requires_physical_receipt",
    "BIC_proxy_is_not_real_Bayesian_evidence",
    "private_corpus_stays_in_private_custody",
    "negative_results_remain_visible",
    "TOKEN_VAZIO_does_not_authorize_invention"
  ],
  "already_present": [
    {
      "id": "RLL-EXISTING-EVIDENCE-CLASSES",
      "state": "DONE",
      "evidence_class": "E",
      "summary": "Contrato E/C/H/P, schema fail-closed, reconciliador da run 31066012098 e fronteira de publicação foram integrados pela PR 646.",
      "source_refs": [
        "docs/governance/RLL_EVIDENCE_CLASSES_V1.md",
        "schemas/rll_evidence_result_v1.schema.json",
        "tools/rll_evidence_reconcile.py",
        "data/governance/rll_publication_boundary_v1.json"
      ]
    },
    {
      "id": "RLL-EXISTING-W0WA-COMPARATOR",
      "state": "IMPLEMENTED_CLAIM_BLOCKED",
      "evidence_class": "C",
      "summary": "CPL/w0waCDM já participa do pipeline conjunto com o mesmo vetor observacional e política de covariância dos demais modelos.",
      "source_refs": [
        "src/rll/cosmology_fairness.py",
        "data/pipelines/structure_d/joint_real_likelihood.py",
        "results/structure_d/joint_real_likelihood.csv",
        "docs/RLL_MISSING_CALCULATIONS_LEDGER.md"
      ]
    },
    {
      "id": "RLL-EXISTING-DESI-13D-BLOCK-MATRIX",
      "state": "PARTIALLY_RESOLVED",
      "evidence_class": "E",
      "summary": "A matriz ordenada 13x13 construída a partir dos seis blocos 2x2 declarados já é reproduzível e testada; não equivale à covariância oficial joint/cross-block.",
      "source_refs": [
        "docs/real_data/RLL_DESI_DR2_COVARIANCE_BLOCK_AUDIT.md",
        "tools/audit_desi_dr2_covariance_blocks.py",
        "tests/test_desi_dr2_covariance_blocks.py"
      ]
    },
    {
      "id": "RLL-EXISTING-NEURO-LANGUAGE-BOUNDARY",
      "state": "IMPLEMENTED_CLAIM_BLOCKED",
      "evidence_class": "E",
      "summary": "A camada neuro/física/linguística já distingue fatos, convenções, hipóteses e vazios; falta reforço bibliográfico primário, não nova separação estrutural.",
      "source_refs": [
        "docs/canonicos/17_ONDA_VERBO_FISICA_NEURO_LINGUAGEM.md"
      ]
    }
  ],
  "queue": [
    {
      "id": "RLL-P0-POSTMERGE-CI-RECEIPT",
      "urgency": "P0",
      "state": "TOKEN_VAZIO_POSTMERGE_FULL_SUITE_RECEIPT",
      "evidence_class": "P",
      "authority": "github_actions",
      "depends_on": [],
      "facts": [
        "PR 645 foi mesclada no commit 73872e3e8aa036d0973a2078f94b87bff2293992.",
        "PR 646 foi mesclada no commit e7997693d4038f379aa0d960a3485f61e94d454b.",
        "A suíte da PR 646 registrou 918 testes aprovados e uma falha histórica 51/60, posteriormente corrigida pela PR 645."
      ],
      "gap": "Não há receipt único observado da suíte completa executada sobre a main contendo simultaneamente os dois merges.",
      "next_action": "Executar a suíte completa e os gates de schema/governança sobre a main pós-merge e materializar logs, JUnit e SHA-256.",
      "acceptance": [
        "pytest completo sem falhas",
        "schema contracts PASS",
        "governance gate PASS",
        "deterministic gate PASS",
        "receipt associado ao commit e7997693d4038f379aa0d960a3485f61e94d454b ou sucessor explícito"
      ],
      "must_not": [
        "inferir verde apenas pela soma de duas PRs",
        "apagar falhas históricas"
      ]
    },
    {
      "id": "RLL-P0-TERMUX-PHYSICAL-REPLAY",
      "urgency": "P0",
      "state": "TOKEN_VAZIO_PHYSICAL_EXECUTION",
      "evidence_class": "P",
      "authority": "termux_physical_device",
      "depends_on": ["RLL-P0-POSTMERGE-CI-RECEIPT"],
      "facts": [
        "O runner scripts/termux/rll_evidence_replay_v1.sh está materializado no repositório.",
        "O runner exige dois ciclos byte-idênticos antes de emitir receipt."
      ],
      "gap": "Nenhum TERMUX_RECEIPT proveniente de aparelho físico foi materializado.",
      "next_action": "Executar o runner em Termux físico com os ZIPs canônicos autorizados e retornar TERMUX_RECEIPT.json, CHECKSUMS.sha256 e log bruto.",
      "acceptance": [
        "device/model e uname registrados",
        "SHA-256 dos ZIPs de entrada conferidos",
        "duas execuções byte-idênticas",
        "SHA-256 dos outputs registrado",
        "timestamp UTC e commit do código registrados"
      ],
      "must_not": [
        "simular receipt físico em container",
        "promover execução x86_64 como Android/ARM"
      ]
    },
    {
      "id": "RLL-P0-PANTHEON-SUCCESSOR-RUN",
      "urgency": "P0",
      "state": "TOKEN_VAZIO_NEW_RUN",
      "evidence_class": "P",
      "authority": "github_actions",
      "depends_on": ["RLL-P0-TERMUX-PHYSICAL-REPLAY"],
      "facts": [
        "A rota legada foi corrigida para usar models_pantheon e caminhos portáveis.",
        "A run 31066012098 permanece historicamente falha para Pantheon e não deve ser reatribuída."
      ],
      "gap": "Ainda não existe nova execução científica que prove a rota corrigida em GitHub Actions.",
      "next_action": "Disparar uma nova run científica na main e preservar run_id, head_sha, inputs, logs, artifacts e checksums.",
      "acceptance": [
        "novo run_id distinto de 31066012098",
        "sem ModuleNotFoundError",
        "artefato Pantheon com checksums internos",
        "resultado classificado E/C/H/P",
        "nenhum valor histórico promovido silenciosamente"
      ],
      "must_not": [
        "editar o artefato histórico da run 31066012098",
        "chamar resultado diagonal de full covariance"
      ]
    },
    {
      "id": "RLL-P0-PANTHEON-FULL-COVARIANCE",
      "urgency": "P0",
      "state": "BLOCKED_BY_EXTERNAL_EVIDENCE",
      "evidence_class": "P",
      "authority": "drive_private_then_github_receipt",
      "depends_on": ["RLL-P0-PANTHEON-SUCCESSOR-RUN"],
      "facts": [
        "O código de likelihood full covariance existe.",
        "Os bytes brutos Pantheon+SH0ES e STAT+SYS não estão materializados no repositório público."
      ],
      "gap": "Faltam bytes autorizados, hashes e receipt de proveniência para o dataset e a matriz oficial.",
      "next_action": "Materializar os arquivos no Drive privado, registrar provider ID, tamanho e SHA-256, e publicar no GitHub apenas manifest/receipt sanitizado.",
      "acceptance": [
        "payloads privados localizados",
        "SHA-256 e tamanho registrados",
        "dimensão da matriz compatível com o vetor",
        "chi2 full-covariance reproduzido",
        "comparação diagonal versus full-covariance emitida"
      ],
      "must_not": [
        "publicar corpus restrito sem licença/autorização",
        "substituir matriz ausente por diagonal sem marcar"
      ]
    },
    {
      "id": "RLL-P0-BAYES-NESTED-SAMPLING",
      "urgency": "P0",
      "state": "TOKEN_VAZIO_REAL_BAYES_INFERENCE",
      "evidence_class": "P",
      "authority": "github_actions_and_independent_review",
      "depends_on": ["RLL-P0-PANTHEON-FULL-COVARIANCE"],
      "facts": [
        "O proxy BIC calculado para a run histórica é ln(B10)=-5.6682695 e F-COS-04=FAIL.",
        "Proxy BIC não é evidência Bayes real."
      ],
      "gap": "Não há nested sampling materializado nem validação posterior independente.",
      "next_action": "Executar nested sampling com priors versionados, seeds, stopping criteria e posterior receipts.",
      "acceptance": [
        "priors versionados",
        "evidências logZ por modelo",
        "incerteza de logZ",
        "convergência documentada",
        "reprodução independente"
      ],
      "must_not": [
        "renomear proxy BIC como Bayes real",
        "omitir resultado desfavorável"
      ]
    },
    {
      "id": "RLL-P1-DESI-VECTOR-LIKELIHOOD",
      "urgency": "P1",
      "state": "PARTIALLY_RESOLVED",
      "evidence_class": "P",
      "authority": "github_plus_official_source_receipt",
      "depends_on": ["RLL-P0-POSTMERGE-CI-RECEIPT"],
      "facts": [
        "Os treze observáveis e os seis blocos 2x2 declarados já geram matriz 13x13 block-diagonal positiva definida.",
        "O repositório já possui fórmulas DM/rd, DH/rd e DV/rd."
      ],
      "gap": "Faltam auditoria independente da transcrição, covariância oficial cross-block quando disponível e fechamento do adapter vetorial no fit.",
      "next_action": "Implementar adapter isolado de predição na ordem canônica e comparar chi2 diagonal versus matricial, sem substituir a rota atual até os gates passarem.",
      "acceptance": [
        "ordem dos treze observáveis provada",
        "unidades e política r_d fixadas",
        "resíduo vetorial reproduzível",
        "chi2=rT C^-1 r",
        "regressão diagonal versus matricial",
        "source receipt independente"
      ],
      "must_not": [
        "chamar matriz block-diagonal de covariância joint oficial",
        "inferir impacto em AIC/BIC antes do fit"
      ]
    },
    {
      "id": "RLL-P1-H0-FORMAL-LIKELIHOOD",
      "urgency": "P1",
      "state": "TOKEN_VAZIO_H0_FORMAL_TEST",
      "evidence_class": "P",
      "authority": "github_plus_versioned_external_priors",
      "depends_on": ["RLL-P0-PANTHEON-FULL-COVARIANCE"],
      "facts": [
        "Há diagnósticos parciais de H0 e valores em outputs.",
        "Não há likelihood formal conjunta Planck/SH0ES com covariância e métrica fechada."
      ],
      "gap": "A afirmação de aliviar H0 permanece bloqueada.",